{
  "$schema": "https://json-schema.org/draft/2020-12/schema",
  "$id": "https://schemas.event-driven-commerce.test/events/order-created-v1.schema.json",
  "title": "OrderCreatedV1", "type": "object", "additionalProperties": false,
  "required": ["eventId","eventType","eventVersion","aggregateId","correlationId","causationId","occurredAt","payload"],
  "properties": {
    "eventId":{"type":"string","format":"uuid"}, "eventType":{"const":"OrderCreatedV1"}, "eventVersion":{"const":1},
    "aggregateId":{"type":"string","format":"uuid"}, "correlationId":{"type":"string","format":"uuid"}, "causationId":{"type":"string","format":"uuid"}, "occurredAt":{"type":"string","format":"date-time"},
    "payload":{"type":"object","additionalProperties":false,"required":["orderId","customerId","lines","totalAmount","currency","shippingAddress"],"properties":{
      "orderId":{"type":"string","format":"uuid"},"customerId":{"type":"string","format":"uuid"},"totalAmount":{"type":"number","minimum":0},"currency":{"type":"string","pattern":"^[A-Z]{3}$"},
      "lines":{"type":"array","minItems":1,"items":{"type":"object","additionalProperties":false,"required":["productId","sku","productName","quantity","unitPrice","totalPrice"],"properties":{"productId":{"type":"string","format":"uuid"},"sku":{"type":"string"},"productName":{"type":"string"},"quantity":{"type":"integer","minimum":1},"unitPrice":{"type":"number","minimum":0},"totalPrice":{"type":"number","minimum":0}}}},
      "shippingAddress":{"type":"object","additionalProperties":false,"required":["recipient","line1","line2","postalCode","city","countryCode"],"properties":{"recipient":{"type":"string"},"line1":{"type":"string"},"line2":{"type":"string"},"postalCode":{"type":"string"},"city":{"type":"string"},"countryCode":{"type":"string","pattern":"^[A-Z]{2}$"}}}
    }}
  }
}
