{"eventId":"10000000-0000-4000-8000-000000000001","eventType":"OrderCreatedV1","eventVersion":1,"aggregateId":"20000000-0000-4000-8000-000000000001","correlationId":"30000000-0000-4000-8000-000000000001","causationId":"30000000-0000-4000-8000-000000000001","occurredAt":"2026-08-06T18:00:00Z","payload":{"orderId":"20000000-0000-4000-8000-000000000001","customerId":"40000000-0000-4000-8000-000000000001","lines":[{"productId":"50000000-0000-4000-8000-000000000001","sku":"SKU-001","productName":"Example product","quantity":2,"unitPrice":99.90,"totalPrice":199.80}],"totalAmount":199.80,"currency":"SEK","shippingAddress":{"recipient":"Example Customer","line1":"Example Street 1","line2":"","postalCode":"11122","city":"Stockholm","countryCode":"SE"}}}
